{
  "schema_version": "idli-result/1",
  "result_id": "fixture-partial-source-outage",
  "request_id": "fixture-request-partial-source-outage",
  "revision": 1,
  "status": "partial",
  "site": {
    "site_id": "synthetic-fixture-site",
    "label": "Synthetic fixture site",
    "pack_digest": "sha256:441c3029758f973949785465b634ad35ed1fcc82c96eeb9414f5840bf7520d37",
    "synthetic": true
  },
  "question": {
    "original": "Show current source coverage.",
    "resolved": "Show last-known-good evidence and disclose failed source refreshes.",
    "bindings": {
      "aoi_ids": [
        "target"
      ],
      "fixture": true
    }
  },
  "answer": {
    "headline": "Most coverage is current; one source refresh failed.",
    "detail": "Synthetic renderer fixture; not evidence about a real place.",
    "evidence_classes": [
      "observed"
    ]
  },
  "visuals": [
    {
      "visual_id": "outage-map",
      "visual_type": "map",
      "view": "source-coverage",
      "title": "Available source coverage",
      "priority": "primary",
      "status": "partial",
      "scope": {
        "aoi_ids": [
          "target",
          "context"
        ],
        "time": {
          "start": null,
          "end": null
        }
      },
      "layers": [
        {
          "layer_id": "last-known-good",
          "evidence_class": "observed",
          "geometry_type": "point",
          "data_ref": {
            "kind": "result_data",
            "handle": "last-known-good",
            "media_type": "application/geo+json",
            "digest": "sha256:da6f906b0561ad74f7b69e728123cbab220526789da094c923ba4d9f1ac41aba"
          },
          "legend": {
            "label": "Last-known-good records"
          },
          "style_hint": {
            "palette_role": "observed"
          }
        }
      ],
      "summary": {
        "headline": "Two sources are current and one is serving its last-known-good version.",
        "denominators": {
          "current_sources": 2,
          "stale_sources": 1
        }
      },
      "drilldowns": [
        {
          "action_id": "inspect-outage-map",
          "label": "Inspect source rows",
          "data_ref": {
            "kind": "result_data",
            "handle": "outage-map-rows",
            "media_type": "application/json",
            "digest": "sha256:ab0ab821bba087a998372827b972b1a1a31e4935dbfbb78c6e89fd86f5761535"
          }
        }
      ],
      "limitations": [
        {
          "code": "source-refresh-failed",
          "severity": "warning",
          "message": "One source refresh failed; last-known-good records remain visible.",
          "affects": [
            "outage-map",
            "answer"
          ],
          "details_ref": null
        }
      ]
    }
  ],
  "limitations": [
    {
      "code": "synthetic-data",
      "severity": "info",
      "message": "This result uses synthetic test data and is not evidence about a real place.",
      "affects": [
        "answer"
      ],
      "details_ref": null
    },
    {
      "code": "source-refresh-failed",
      "severity": "warning",
      "message": "One source refresh failed; last-known-good records remain visible.",
      "affects": [
        "outage-map",
        "answer"
      ],
      "details_ref": null
    }
  ],
  "actions": [],
  "audit": {
    "audit_id": "fixture-audit-partial-source-outage",
    "source_versions": [
      {
        "source_id": "synthetic-fixture-source",
        "version": "1",
        "digest": "sha256:2cd8e78358496ffb42513a6fa0602aa9b5710a910ba18cdbec043722d00ca2fb",
        "synthetic": true
      }
    ],
    "capability_runs": [
      {
        "capability_id": "source-coverage",
        "version": "1.0.0",
        "status": "partial"
      }
    ],
    "query_hash": "sha256:1167089c28a15487a72e04a1eac6cda8492cabde13447d9dc0f93893d9478e58"
  }
}
