{
  "schema_version": "idli-result/1",
  "result_id": "fixture-observed-points",
  "request_id": "fixture-request-observed-points",
  "revision": 1,
  "status": "complete",
  "site": {
    "site_id": "synthetic-fixture-site",
    "label": "Synthetic fixture site",
    "pack_digest": "sha256:441c3029758f973949785465b634ad35ed1fcc82c96eeb9414f5840bf7520d37"
  },
  "question": {
    "original": "Where has this entity been recorded?",
    "resolved": "Map admitted observations for the resolved entity.",
    "bindings": {
      "aoi_ids": [
        "target"
      ],
      "fixture": true
    }
  },
  "answer": {
    "headline": "Thirty-two source-linked records are available.",
    "detail": "Synthetic renderer fixture; not evidence about a real place.",
    "evidence_classes": [
      "observed"
    ]
  },
  "visuals": [
    {
      "visual_id": "observed-map",
      "visual_type": "map",
      "view": "observed-points",
      "title": "Where records are available",
      "priority": "primary",
      "status": "ready",
      "scope": {
        "aoi_ids": [
          "target",
          "context"
        ],
        "time": {
          "start": null,
          "end": null
        }
      },
      "layers": [
        {
          "layer_id": "observations",
          "evidence_class": "observed",
          "geometry_type": "point",
          "data_ref": {
            "kind": "result_data",
            "handle": "observations",
            "media_type": "application/geo+json",
            "digest": "sha256:bfc5a6b45b6a16128fbf94195a8b6895883b709e9ab0bf0bc5dc5a14fa18cf2f"
          },
          "legend": {
            "label": "Observed records"
          },
          "style_hint": {
            "palette_role": "observed"
          }
        }
      ],
      "summary": {
        "headline": "Thirty-two source-linked records are available.",
        "denominators": {
          "records": 32,
          "sources": 2,
          "surveyed_cells": 9
        }
      },
      "drilldowns": [
        {
          "action_id": "inspect-observed-map",
          "label": "Inspect source rows",
          "data_ref": {
            "kind": "result_data",
            "handle": "observed-map-rows",
            "media_type": "application/json",
            "digest": "sha256:920d3f3d29c322a323d05a7691571f86ac6af4ab7971cc23ab918cb3f439a34c"
          }
        }
      ],
      "limitations": []
    }
  ],
  "limitations": [],
  "actions": [],
  "audit": {
    "audit_id": "fixture-audit-observed-points",
    "source_versions": [
      {
        "source_id": "synthetic-fixture-source",
        "version": "1",
        "digest": "sha256:2cd8e78358496ffb42513a6fa0602aa9b5710a910ba18cdbec043722d00ca2fb"
      }
    ],
    "capability_runs": [
      {
        "capability_id": "observed-presence-map",
        "version": "1.0.0",
        "status": "complete"
      }
    ],
    "query_hash": "sha256:6402116ec1da7140f58a36180df66f32e7a9b7ab89d6eb33164fa1d4c93f587f"
  }
}
