{
  "schema_version": "idli-result/1",
  "result_id": "fixture-coverage-effort",
  "request_id": "fixture-request-coverage-effort",
  "revision": 1,
  "status": "complete",
  "site": {
    "site_id": "synthetic-fixture-site",
    "label": "Synthetic fixture site",
    "pack_digest": "sha256:441c3029758f973949785465b634ad35ed1fcc82c96eeb9414f5840bf7520d37",
    "synthetic": true
  },
  "question": {
    "original": "Where are there records and survey effort?",
    "resolved": "Compare record coverage with explicit effort denominators.",
    "bindings": {
      "aoi_ids": [
        "target"
      ],
      "fixture": true
    }
  },
  "answer": {
    "headline": "Documented effort covers 7 of 12 record cells.",
    "detail": "Synthetic renderer fixture; not evidence about a real place.",
    "evidence_classes": [
      "observed",
      "derived"
    ]
  },
  "visuals": [
    {
      "visual_id": "coverage-effort-map",
      "visual_type": "map",
      "view": "coverage-and-effort",
      "title": "Records and documented effort",
      "priority": "primary",
      "status": "ready",
      "scope": {
        "aoi_ids": [
          "target",
          "context"
        ],
        "time": {
          "start": null,
          "end": null
        }
      },
      "layers": [
        {
          "layer_id": "coverage",
          "evidence_class": "derived",
          "geometry_type": "cell",
          "data_ref": {
            "kind": "result_data",
            "handle": "coverage",
            "media_type": "application/geo+json",
            "digest": "sha256:8d450fb1ba7e3d83386e39d7cb6feeb693e42de0c54792af0af2b6e50ba51fce"
          },
          "legend": {
            "label": "Record coverage"
          },
          "style_hint": {
            "palette_role": "derived"
          },
          "denominator_ref": {
            "kind": "result_data",
            "handle": "effort",
            "media_type": "application/geo+json",
            "digest": "sha256:acf4dd2e282fdef79ddbc4b84d1a1d022eba0ba5a433ab8014c0de580bb5845d"
          },
          "absence_semantics": "non_detection"
        },
        {
          "layer_id": "effort",
          "evidence_class": "observed",
          "geometry_type": "line",
          "data_ref": {
            "kind": "result_data",
            "handle": "effort",
            "media_type": "application/geo+json",
            "digest": "sha256:acf4dd2e282fdef79ddbc4b84d1a1d022eba0ba5a433ab8014c0de580bb5845d"
          },
          "legend": {
            "label": "Documented survey effort"
          },
          "style_hint": {
            "palette_role": "observed"
          }
        }
      ],
      "summary": {
        "headline": "Effort is documented in 7 of the 12 cells containing records.",
        "denominators": {
          "record_cells": 12,
          "effort_cells": 7
        }
      },
      "drilldowns": [
        {
          "action_id": "inspect-coverage-effort-map",
          "label": "Inspect source rows",
          "data_ref": {
            "kind": "result_data",
            "handle": "coverage-effort-map-rows",
            "media_type": "application/json",
            "digest": "sha256:2340a101144000260e5c658f6f71cc29b379065989cb5b91642475e98cecae06"
          }
        }
      ],
      "limitations": []
    }
  ],
  "limitations": [
    {
      "code": "synthetic-data",
      "severity": "info",
      "message": "This result uses synthetic test data and is not evidence about a real place.",
      "affects": [
        "answer"
      ],
      "details_ref": null
    }
  ],
  "actions": [],
  "audit": {
    "audit_id": "fixture-audit-coverage-effort",
    "source_versions": [
      {
        "source_id": "synthetic-fixture-source",
        "version": "1",
        "digest": "sha256:2cd8e78358496ffb42513a6fa0602aa9b5710a910ba18cdbec043722d00ca2fb",
        "synthetic": true
      }
    ],
    "capability_runs": [
      {
        "capability_id": "coverage-versus-effort",
        "version": "1.0.0",
        "status": "complete"
      }
    ],
    "query_hash": "sha256:53b94c731917f3bf15ce354aba1f5e1dec32e65bc49f1aadafd05f8aad695c6e"
  }
}
