{
  "schema_version": "idli-result/1",
  "result_id": "fixture-coverage-effort",
  "request_id": "fixture-request-coverage-effort",
  "revision": 1,
  "status": "complete",
  "site": {
    "site_id": "synthetic-fixture-site",
    "label": "Synthetic fixture site",
    "pack_digest": "sha256:441c3029758f973949785465b634ad35ed1fcc82c96eeb9414f5840bf7520d37"
  },
  "question": {
    "original": "Where are there records and survey effort?",
    "resolved": "Compare record coverage with explicit effort denominators.",
    "bindings": {
      "aoi_ids": [
        "target"
      ],
      "fixture": true
    }
  },
  "answer": {
    "headline": "Documented effort covers 7 of 12 record cells.",
    "detail": "Synthetic renderer fixture; not evidence about a real place.",
    "evidence_classes": [
      "observed",
      "derived"
    ]
  },
  "visuals": [
    {
      "visual_id": "coverage-effort-map",
      "visual_type": "map",
      "view": "coverage-and-effort",
      "title": "Records and documented effort",
      "priority": "primary",
      "status": "ready",
      "scope": {
        "aoi_ids": [
          "target",
          "context"
        ],
        "time": {
          "start": null,
          "end": null
        }
      },
      "layers": [
        {
          "layer_id": "coverage",
          "evidence_class": "derived",
          "geometry_type": "cell",
          "data_ref": {
            "kind": "result_data",
            "handle": "coverage",
            "media_type": "application/geo+json",
            "digest": "sha256:c3a3091b9d32267d0b3175ee14f70a1e0b3d7292d0a0fa45020ced5fb764d620"
          },
          "legend": {
            "label": "Record coverage"
          },
          "style_hint": {
            "palette_role": "derived"
          }
        },
        {
          "layer_id": "effort",
          "evidence_class": "observed",
          "geometry_type": "line",
          "data_ref": {
            "kind": "result_data",
            "handle": "effort",
            "media_type": "application/geo+json",
            "digest": "sha256:a4f12c3895258d0b6e32d9a4d692057c8cfcd5f8efc97dbdf7cefe1c46382b89"
          },
          "legend": {
            "label": "Documented survey effort"
          },
          "style_hint": {
            "palette_role": "observed"
          }
        }
      ],
      "summary": {
        "headline": "Effort is documented in 7 of the 12 cells containing records.",
        "denominators": {
          "record_cells": 12,
          "effort_cells": 7
        }
      },
      "drilldowns": [
        {
          "action_id": "inspect-coverage-effort-map",
          "label": "Inspect source rows",
          "data_ref": {
            "kind": "result_data",
            "handle": "coverage-effort-map-rows",
            "media_type": "application/json",
            "digest": "sha256:15236b7b3dedab3f3dc20308d5c93c55dab50c98d2dc4c4f95912074edda9503"
          }
        }
      ],
      "limitations": []
    }
  ],
  "limitations": [],
  "actions": [],
  "audit": {
    "audit_id": "fixture-audit-coverage-effort",
    "source_versions": [
      {
        "source_id": "synthetic-fixture-source",
        "version": "1",
        "digest": "sha256:2cd8e78358496ffb42513a6fa0602aa9b5710a910ba18cdbec043722d00ca2fb"
      }
    ],
    "capability_runs": [
      {
        "capability_id": "coverage-versus-effort",
        "version": "1.0.0",
        "status": "complete"
      }
    ],
    "query_hash": "sha256:53b94c731917f3bf15ce354aba1f5e1dec32e65bc49f1aadafd05f8aad695c6e"
  }
}
