{
  "schema_version": "idli-result/1",
  "result_id": "fixture-dashboard",
  "request_id": "fixture-request-dashboard",
  "revision": 1,
  "status": "complete",
  "site": {
    "site_id": "synthetic-fixture-site",
    "label": "Synthetic fixture site",
    "pack_digest": "sha256:441c3029758f973949785465b634ad35ed1fcc82c96eeb9414f5840bf7520d37",
    "synthetic": true
  },
  "question": {
    "original": "Summarise this investigation as a dashboard.",
    "resolved": "Compose immutable prior results without recomputing their evidence.",
    "bindings": {
      "aoi_ids": [
        "target"
      ],
      "fixture": true
    }
  },
  "answer": {
    "headline": "Four audited results are ready in one dashboard.",
    "detail": "Synthetic renderer fixture; not evidence about a real place.",
    "evidence_classes": [
      "derived"
    ]
  },
  "visuals": [
    {
      "visual_id": "dashboard",
      "visual_type": "dashboard",
      "view": "composed-results",
      "title": "Investigation dashboard",
      "priority": "primary",
      "status": "ready",
      "scope": {
        "aoi_ids": [
          "target",
          "context"
        ],
        "time": {
          "start": null,
          "end": null
        }
      },
      "layers": [
        {
          "layer_id": "result-cards",
          "evidence_class": "derived",
          "geometry_type": "none",
          "data_ref": {
            "kind": "result_data",
            "handle": "result-cards",
            "media_type": "application/json",
            "digest": "sha256:6d0260e0f062ef097655821b58ebb5893305f5263d56254be670d865dbfe17cf"
          },
          "legend": {
            "label": "Immutable prior results"
          },
          "style_hint": {
            "palette_role": "derived"
          }
        }
      ],
      "summary": {
        "headline": "The dashboard composes four immutable prior results.",
        "denominators": {
          "results": 4,
          "maps": 2,
          "charts": 1,
          "gaps": 1
        }
      },
      "drilldowns": [],
      "limitations": []
    }
  ],
  "limitations": [
    {
      "code": "synthetic-data",
      "severity": "info",
      "message": "This result uses synthetic test data and is not evidence about a real place.",
      "affects": [
        "answer"
      ],
      "details_ref": null
    }
  ],
  "actions": [
    {
      "action_id": "export-report",
      "kind": "export_report",
      "label": "Export an audited report",
      "capability_id": "export-report",
      "arguments": {
        "result_ids": [
          "fixture-a",
          "fixture-b"
        ]
      },
      "requires_confirmation": true
    }
  ],
  "audit": {
    "audit_id": "fixture-audit-dashboard",
    "source_versions": [
      {
        "source_id": "synthetic-fixture-source",
        "version": "1",
        "digest": "sha256:2cd8e78358496ffb42513a6fa0602aa9b5710a910ba18cdbec043722d00ca2fb",
        "synthetic": true
      }
    ],
    "capability_runs": [
      {
        "capability_id": "compose-dashboard",
        "version": "1.0.0",
        "status": "complete"
      }
    ],
    "query_hash": "sha256:87dd7b6b83c44b81d083e59cf8539e10059e2f454027286ccefa34500bc72d84"
  }
}
