{
  "schema_version": "idli-result/1",
  "result_id": "fixture-data-request",
  "request_id": "fixture-request-data-request",
  "revision": 1,
  "status": "complete",
  "site": {
    "site_id": "synthetic-fixture-site",
    "label": "Synthetic fixture site",
    "pack_digest": "sha256:441c3029758f973949785465b634ad35ed1fcc82c96eeb9414f5840bf7520d37",
    "synthetic": true
  },
  "question": {
    "original": "Where should the next survey happen?",
    "resolved": "Rank feasible collection locations using a versioned uncertainty surface.",
    "bindings": {
      "aoi_ids": [
        "target"
      ],
      "fixture": true
    }
  },
  "answer": {
    "headline": "Eight candidate locations are ranked for additional collection.",
    "detail": "Synthetic renderer fixture; not evidence about a real place.",
    "evidence_classes": [
      "modelled",
      "designed"
    ]
  },
  "visuals": [
    {
      "visual_id": "data-request-map",
      "visual_type": "map",
      "view": "value-of-information",
      "title": "Where another measurement would help most",
      "priority": "primary",
      "status": "ready",
      "scope": {
        "aoi_ids": [
          "target",
          "context"
        ],
        "time": {
          "start": null,
          "end": null
        }
      },
      "layers": [
        {
          "layer_id": "uncertainty-surface",
          "evidence_class": "modelled",
          "geometry_type": "raster",
          "data_ref": {
            "kind": "result_data",
            "handle": "uncertainty-surface",
            "media_type": "application/geo+json",
            "digest": "sha256:e4764305b66cd15a5182093ae74545cbce16b9f21c454e051c70fda6fa873b35"
          },
          "legend": {
            "label": "Current uncertainty"
          },
          "style_hint": {
            "palette_role": "modelled"
          }
        },
        {
          "layer_id": "candidate-actions",
          "evidence_class": "designed",
          "geometry_type": "point",
          "data_ref": {
            "kind": "result_data",
            "handle": "candidate-actions",
            "media_type": "application/geo+json",
            "digest": "sha256:604a54866a4f1cfce64a662a6a6b83b701cf97206e816395b8f804212dd3dd5c"
          },
          "legend": {
            "label": "Candidate collection locations"
          },
          "style_hint": {
            "palette_role": "designed"
          }
        }
      ],
      "summary": {
        "headline": "Eight candidate locations are ranked by expected information gain.",
        "denominators": {
          "candidate_locations": 8,
          "accessible_locations": 6
        }
      },
      "drilldowns": [
        {
          "action_id": "inspect-data-request-map",
          "label": "Inspect source rows",
          "data_ref": {
            "kind": "result_data",
            "handle": "data-request-map-rows",
            "media_type": "application/json",
            "digest": "sha256:c713c6c6b07296f7eb3611128a8ab27972ab269c95297a09b9b79e8672bfaf4f"
          }
        }
      ],
      "limitations": []
    }
  ],
  "limitations": [
    {
      "code": "synthetic-data",
      "severity": "info",
      "message": "This result uses synthetic test data and is not evidence about a real place.",
      "affects": [
        "answer"
      ],
      "details_ref": null
    }
  ],
  "actions": [
    {
      "action_id": "submit-data-request",
      "kind": "request_data",
      "label": "Submit this data request",
      "capability_id": "request-data",
      "arguments": {
        "candidate_layer": "candidate-actions"
      },
      "requires_confirmation": true
    }
  ],
  "audit": {
    "audit_id": "fixture-audit-data-request",
    "source_versions": [
      {
        "source_id": "synthetic-fixture-source",
        "version": "1",
        "digest": "sha256:2cd8e78358496ffb42513a6fa0602aa9b5710a910ba18cdbec043722d00ca2fb",
        "synthetic": true
      }
    ],
    "capability_runs": [
      {
        "capability_id": "value-of-information",
        "version": "1.0.0",
        "status": "complete"
      }
    ],
    "query_hash": "sha256:6110b497a5c5aef5540ce1e74039ddb3643ae26316db80cddd341faa0c391216"
  }
}
