{
  "schema_version": "idli-result/1",
  "result_id": "fixture-time-series",
  "request_id": "fixture-request-time-series",
  "revision": 1,
  "status": "complete",
  "site": {
    "site_id": "synthetic-fixture-site",
    "label": "Synthetic fixture site",
    "pack_digest": "sha256:441c3029758f973949785465b634ad35ed1fcc82c96eeb9414f5840bf7520d37",
    "synthetic": true
  },
  "question": {
    "original": "How has this metric changed through time?",
    "resolved": "Plot unit-compatible measurements with an explicit coverage strip.",
    "bindings": {
      "aoi_ids": [
        "target"
      ],
      "fixture": true
    }
  },
  "answer": {
    "headline": "Sixty monthly values are available; three months are missing.",
    "detail": "Synthetic renderer fixture; not evidence about a real place.",
    "evidence_classes": [
      "observed",
      "derived"
    ]
  },
  "visuals": [
    {
      "visual_id": "time-series",
      "visual_type": "chart",
      "view": "metric-time-series",
      "title": "Metric through time",
      "priority": "primary",
      "status": "ready",
      "scope": {
        "aoi_ids": [
          "target",
          "context"
        ],
        "time": {
          "start": null,
          "end": null
        }
      },
      "layers": [
        {
          "layer_id": "metric-series",
          "evidence_class": "observed",
          "geometry_type": "series",
          "data_ref": {
            "kind": "result_data",
            "handle": "metric-series",
            "media_type": "application/json",
            "digest": "sha256:539418858a87f787863a6529eafebfbd7ae6d7444c38bb6a09994adb2a0d9616"
          },
          "legend": {
            "label": "Monthly measurements"
          },
          "style_hint": {
            "palette_role": "observed"
          },
          "uncertainty": {
            "kind": "interval",
            "level": 0.8,
            "inline": true
          }
        },
        {
          "layer_id": "coverage-strip",
          "evidence_class": "derived",
          "geometry_type": "series",
          "data_ref": {
            "kind": "result_data",
            "handle": "coverage-strip",
            "media_type": "application/json",
            "digest": "sha256:db14b781eeb884841dbac03f292d1ddf1c92001642f883419231b0095617e227"
          },
          "legend": {
            "label": "Monthly coverage"
          },
          "style_hint": {
            "palette_role": "derived"
          }
        }
      ],
      "summary": {
        "headline": "The chart contains 60 monthly values with units and coverage.",
        "denominators": {
          "months": 60,
          "missing_months": 3,
          "sources": 1
        }
      },
      "drilldowns": [
        {
          "action_id": "inspect-time-series",
          "label": "Inspect source rows",
          "data_ref": {
            "kind": "result_data",
            "handle": "time-series-rows",
            "media_type": "application/json",
            "digest": "sha256:54c3e8bbc1e7fa0ae8e5c80b0f3f55991870bce51e668ac7ff641055bae98f64"
          }
        }
      ],
      "limitations": [],
      "annotations": [
        {
          "anchor": {
            "kind": "point",
            "t": "2023-12-01",
            "value": 32.16
          },
          "text": "Highest value in the record",
          "emphasis": "primary"
        }
      ]
    }
  ],
  "limitations": [
    {
      "code": "synthetic-data",
      "severity": "info",
      "message": "This result uses synthetic test data and is not evidence about a real place.",
      "affects": [
        "answer"
      ],
      "details_ref": null
    }
  ],
  "actions": [],
  "audit": {
    "audit_id": "fixture-audit-time-series",
    "source_versions": [
      {
        "source_id": "synthetic-fixture-source",
        "version": "1",
        "digest": "sha256:2cd8e78358496ffb42513a6fa0602aa9b5710a910ba18cdbec043722d00ca2fb",
        "synthetic": true
      }
    ],
    "capability_runs": [
      {
        "capability_id": "metric-time-series",
        "version": "1.0.0",
        "status": "complete"
      }
    ],
    "query_hash": "sha256:f39f924a4a1eb4147b786bbf6a0094278c57bf1c0102b1b8c6fa3cec262e2661"
  }
}
